{
  "runtime": {
    "name": "Claude.ai",
    "version": null
  },
  "support_level": "reduced",
  "capabilities": {
    "structured_choice": "basic",
    "freeform_input": true,
    "file_presentation": "inline",
    "local_html": "inline",
    "subprocess": false,
    "pause_resume": true,
    "file_read_write": "limited",
    "long_term_memory": false
  },
  "native_mappings": {
    "choose": "structured chat prompt",
    "ask": "normal conversation turn",
    "present": "present_files",
    "run": null,
    "pause": "wait for next user response",
    "read": "session/local file access when available",
    "write": "session artifact or limited file output",
    "append": "session artifact or limited file output",
    "memory_lookup": null,
    "memory_store": null
  },
  "downgrades": [
    {
      "capability": "subprocess",
      "effect": "external_tool verifiers unavailable"
    },
    {
      "capability": "file_read_write",
      "effect": "persistent memory requires a connector or project-pack sync loop"
    }
  ]
}
